source	balise	occurrence	texte
MTAL_00220_propre_p84_104_AV	Appellation Courte	1	. Esculape.
MTAL_00220_propre_p84_104_AV	Appellation Courte	1	. Abondance.
MTAL_00220_propre_p84_104_AV	Appellation Courte	1	. Albin.
MTAL_00220_propre_p84_104_AV	Appellation Courte	3	. Bacchante.
MTAL_00220_propre_p84_104_AV	Appellation Courte	1	. Biane.
MTAL_00220_propre_p84_104_AV	Appellation Courte	1	. Béesse Rome.
MTAL_00220_propre_p84_104_AV	Appellation Courte	1	. Béesse.
MTAL_00220_propre_p84_104_AV	Appellation Courte	1	. Cicéron.
MTAL_00220_propre_p84_104_AV	Appellation Courte	1	. Crispine.
MTAL_00220_propre_p84_104_AV	Appellation Courte	1	. Crispus.
MTAL_00220_propre_p84_104_AV	Appellation Courte	2	. Dioscure
MTAL_00220_propre_p84_104_AV	Appellation Courte	1	. Déesse Rome
MTAL_00220_propre_p84_104_AV	Appellation Courte	1	. Faustine.
MTAL_00220_propre_p84_104_AV	Appellation Courte	1	. Germanicus.
MTAL_00220_propre_p84_104_AV	Appellation Courte	3	. Hercule.
MTAL_00220_propre_p84_104_AV	Appellation Courte	1	. Hésiode.
MTAL_00220_propre_p84_104_AV	Appellation Courte	1	. Juba.
MTAL_00220_propre_p84_104_AV	Appellation Courte	1	. Jupiter.
MTAL_00220_propre_p84_104_AV	Appellation Courte	1	. Laocoon
MTAL_00220_propre_p84_104_AV	Appellation Courte	1	. Masque.
MTAL_00220_propre_p84_104_AV	Appellation Courte	1	. Mercure.
MTAL_00220_propre_p84_104_AV	Appellation Courte	1	. Numa.
MTAL_00220_propre_p84_104_AV	Appellation Courte	1	. Plotine.
MTAL_00220_propre_p84_104_AV	Appellation Courte	2	. Pompée.
MTAL_00220_propre_p84_104_AV	Appellation Courte	1	. Ptolémée.
MTAL_00220_propre_p84_104_AV	Appellation Courte	1	. Pyrrhus.
MTAL_00220_propre_p84_104_AV	Appellation Courte	1	. Scipion.
MTAL_00220_propre_p84_104_AV	Appellation Courte	1	. Silène.
MTAL_00220_propre_p84_104_AV	Appellation Courte	1	L'Hercule
MTAL_00220_propre_p84_104_AV	Appellation Courte	1	la déesse Salus
MTAL_00220_propre_p84_104_AV	Appellation Courte	1	les Abraxas
MTAL_00220_propre_p84_104_AV	Appellation Courte	1	un Esculape
MTAL_00220_propre_p84_104_AV	Appellation Courte	1	un Laocoon
MTAL_00220_propre_p84_104_AV	Appellation Structuree	1	Agate blanche. Amulette d'Isis
MTAL_00220_propre_p84_104_AV	Appellation Structuree	1	Agate blanche. Triomphe de Pompée
MTAL_00220_propre_p84_104_AV	Appellation Structuree	1	Agate blanche. Ulysse cherchant Astyanax
MTAL_00220_propre_p84_104_AV	Appellation Structuree	1	Agate grise. Triomphe d'un athlète
MTAL_00220_propre_p84_104_AV	Appellation Structuree	1	Agate mêlée de blanc. Mars et la Victoire (?)
MTAL_00220_propre_p84_104_AV	Appellation Structuree	1	Agate onyx à biseau. Vénus victorieuse
MTAL_00220_propre_p84_104_AV	Appellation Structuree	1	Agate onyx. Amour sur cheval marin
MTAL_00220_propre_p84_104_AV	Appellation Structuree	1	Agate onyx. Déesse Rome
MTAL_00220_propre_p84_104_AV	Appellation Structuree	1	Agate onyx. Guerrier au repos
MTAL_00220_propre_p84_104_AV	Appellation Structuree	1	Agate onyx. Hygie
MTAL_00220_propre_p84_104_AV	Appellation Structuree	1	Agate onyx. Mars et Vénus
MTAL_00220_propre_p84_104_AV	Appellation Structuree	1	Agate onyx. Mercure avec tous ses attributs
MTAL_00220_propre_p84_104_AV	Appellation Structuree	1	Agate onyx. Piété militaire
MTAL_00220_propre_p84_104_AV	Appellation Structuree	1	Agate onyx. Tête de Mercure
MTAL_00220_propre_p84_104_AV	Appellation Structuree	1	Agate onyx. Victoire
MTAL_00220_propre_p84_104_AV	Appellation Structuree	1	Agate onyx. Victoire sur quadrige
MTAL_00220_propre_p84_104_AV	Appellation Structuree	1	Agate orientale. La déesse Rome devant la statue de Mars
MTAL_00220_propre_p84_104_AV	Appellation Structuree	1	Agate orientale. Le Temps appuyé sur sa faux
MTAL_00220_propre_p84_104_AV	Appellation Structuree	1	Agate rubanée. La continence deScipion
MTAL_00220_propre_p84_104_AV	Appellation Structuree	1	Agate veinée. Bacchus et Ariane sur un char
MTAL_00220_propre_p84_104_AV	Appellation Structuree	1	Agate. Apollon
MTAL_00220_propre_p84_104_AV	Appellation Structuree	1	Agathe onyx. Bonus Evenius
MTAL_00220_propre_p84_104_AV	Appellation Structuree	1	Agathe onyx. Hercule écrasant les serpents
MTAL_00220_propre_p84_104_AV	Appellation Structuree	1	Amour assis jouant avec un cygne. Sardonyx
MTAL_00220_propre_p84_104_AV	Appellation Structuree	1	Amour assis jouant de la lyre. Sardonyx
MTAL_00220_propre_p84_104_AV	Appellation Structuree	1	Améthyste. Amour tenant une lyre
MTAL_00220_propre_p84_104_AV	Appellation Structuree	1	Améthyste. Satyre et Bacchus juvénile
MTAL_00220_propre_p84_104_AV	Appellation Structuree	1	Bacchante tenant un thyrse. Sardonyx
MTAL_00220_propre_p84_104_AV	Appellation Structuree	2	Cachet de Michel-Ange
MTAL_00220_propre_p84_104_AV	Appellation Structuree	1	Calcédoine. Jupiter sur son trône
MTAL_00220_propre_p84_104_AV	Appellation Structuree	1	Cornaline brûlée. Hercule Musagète
MTAL_00220_propre_p84_104_AV	Appellation Structuree	1	Cornaline de la collection Chaduc. Sacrifice
MTAL_00220_propre_p84_104_AV	Appellation Structuree	1	Cornaline, Aigle tenant une couronne
MTAL_00220_propre_p84_104_AV	Appellation Structuree	1	Cornaline, Ouvrier forgeant un casque
MTAL_00220_propre_p84_104_AV	Appellation Structuree	1	Cornaline. Apollon et Amour
MTAL_00220_propre_p84_104_AV	Appellation Structuree	1	Cornaline. Apollon et une Muse
MTAL_00220_propre_p84_104_AV	Appellation Structuree	1	Cornaline. Athlète demandant le prix de sa victoire
MTAL_00220_propre_p84_104_AV	Appellation Structuree	1	Cornaline. Bacchanale
MTAL_00220_propre_p84_104_AV	Appellation Structuree	1	Cornaline. Bacchante en délire devant un terme de Priape
MTAL_00220_propre_p84_104_AV	Appellation Structuree	1	Cornaline. Bacchante faisant une libation sur un autel rustique
MTAL_00220_propre_p84_104_AV	Appellation Structuree	1	Cornaline. Bacchus sacrifiant
MTAL_00220_propre_p84_104_AV	Appellation Structuree	1	Cornaline. Cavalier attaquant un lion
MTAL_00220_propre_p84_104_AV	Appellation Structuree	1	Cornaline. Cerf assailli par un lion
MTAL_00220_propre_p84_104_AV	Appellation Structuree	2	Cornaline. Chasse
MTAL_00220_propre_p84_104_AV	Appellation Structuree	1	Cornaline. Combat de cavaliers
MTAL_00220_propre_p84_104_AV	Appellation Structuree	1	Cornaline. Diomède maître du Palladium
MTAL_00220_propre_p84_104_AV	Appellation Structuree	1	Cornaline. Esculape
MTAL_00220_propre_p84_104_AV	Appellation Structuree	1	Cornaline. Esculape et Diane d'Êphèse
MTAL_00220_propre_p84_104_AV	Appellation Structuree	1	Cornaline. Ganymède et l'aigle
MTAL_00220_propre_p84_104_AV	Appellation Structuree	1	Cornaline. Guerrier ou Mars
MTAL_00220_propre_p84_104_AV	Appellation Structuree	1	Cornaline. Guerrier sacrifiant
MTAL_00220_propre_p84_104_AV	Appellation Structuree	1	Cornaline. Génie bachique conduisant un char
MTAL_00220_propre_p84_104_AV	Appellation Structuree	1	Cornaline. Hercule assommant Diomède
MTAL_00220_propre_p84_104_AV	Appellation Structuree	3	Cornaline. Hercule aurepos
MTAL_00220_propre_p84_104_AV	Appellation Structuree	1	Cornaline. Hercule brûlant l'hydre
MTAL_00220_propre_p84_104_AV	Appellation Structuree	1	Cornaline. Hercule et OEdipe
MTAL_00220_propre_p84_104_AV	Appellation Structuree	1	Cornaline. Hygie (?) 
MTAL_00220_propre_p84_104_AV	Appellation Structuree	1	Cornaline. Isis et Anubis
MTAL_00220_propre_p84_104_AV	Appellation Structuree	2	Cornaline. Jupiter
MTAL_00220_propre_p84_104_AV	Appellation Structuree	1	Cornaline. L'Abondance
MTAL_00220_propre_p84_104_AV	Appellation Structuree	1	Cornaline. L'Amour redemande son arc à Vénus
MTAL_00220_propre_p84_104_AV	Appellation Structuree	1	Cornaline. Laocoon
MTAL_00220_propre_p84_104_AV	Appellation Structuree	1	Cornaline. Muse et Amour
MTAL_00220_propre_p84_104_AV	Appellation Structuree	1	Cornaline. Sacrifice à Bacchus
MTAL_00220_propre_p84_104_AV	Appellation Structuree	2	Cornaline. Sacrifice à Priape
MTAL_00220_propre_p84_104_AV	Appellation Structuree	1	Cornaline. Sculpteur travaillant à un vase
MTAL_00220_propre_p84_104_AV	Appellation Structuree	1	Cornaline. Scène de sacrifice
MTAL_00220_propre_p84_104_AV	Appellation Structuree	1	Cornaline. Sérapis
MTAL_00220_propre_p84_104_AV	Appellation Structuree	1	Cornaline. Thésée et le Minotaure
MTAL_00220_propre_p84_104_AV	Appellation Structuree	1	Cornaline. Triomphe d'un empereur
MTAL_00220_propre_p84_104_AV	Appellation Structuree	1	Cornaline. Triomphede Bacchus
MTAL_00220_propre_p84_104_AV	Appellation Structuree	1	Cornaline. Victoire sur bige
MTAL_00220_propre_p84_104_AV	Appellation Structuree	1	Cornaline. Victoire écrivant sur un bouclier
MTAL_00220_propre_p84_104_AV	Appellation Structuree	1	Cornaline. Vénus
MTAL_00220_propre_p84_104_AV	Appellation Structuree	1	Cornaline. Vénus avec les armes de Mars
MTAL_00220_propre_p84_104_AV	Appellation Structuree	1	Cornaline. Vénus ou Victoire (?)
MTAL_00220_propre_p84_104_AV	Appellation Structuree	1	Cornaline. Vénus sur un bouc
MTAL_00220_propre_p84_104_AV	Appellation Structuree	1	Cornaline. « Fête à la suite des vendanges »
MTAL_00220_propre_p84_104_AV	Appellation Structuree	1	Cornaline. « L'Amour debout sur un autel
MTAL_00220_propre_p84_104_AV	Appellation Structuree	1	Cornaline. « Le temple de la jeunesse »
MTAL_00220_propre_p84_104_AV	Appellation Structuree	1	Cornaline. Érection de la statue d'un dieu
MTAL_00220_propre_p84_104_AV	Appellation Structuree	1	Diane d'Êphèse
MTAL_00220_propre_p84_104_AV	Appellation Structuree	1	Faustine jeune, tête
MTAL_00220_propre_p84_104_AV	Appellation Structuree	1	Faustine jeune, tête. Sardonyx
MTAL_00220_propre_p84_104_AV	Appellation Structuree	1	Grenat. Mên
MTAL_00220_propre_p84_104_AV	Appellation Structuree	1	Hercule tenant la massue et couronnant Minerve armée. Sardonyx
MTAL_00220_propre_p84_104_AV	Appellation Structuree	1	Hyacinthe. Grylle (tête casquée et Socrate)
MTAL_00220_propre_p84_104_AV	Appellation Structuree	1	Jaspe .noir. Sacrifice d'un serpent
MTAL_00220_propre_p84_104_AV	Appellation Structuree	1	Jaspe noir. Grylle
MTAL_00220_propre_p84_104_AV	Appellation Structuree	1	Jaspe rouge. Hercule dompté par l'Amour
MTAL_00220_propre_p84_104_AV	Appellation Structuree	1	Jaspe rouge. Pescennius Niger (?)
MTAL_00220_propre_p84_104_AV	Appellation Structuree	1	Jaspe sanguin . Cérès cherchant Proserpine
MTAL_00220_propre_p84_104_AV	Appellation Structuree	1	Jaspe sanguin. Apollon et Marsyas
MTAL_00220_propre_p84_104_AV	Appellation Structuree	1	Jaspe sanguin. Cerbère enchaîné par Hercule
MTAL_00220_propre_p84_104_AV	Appellation Structuree	1	Jaspe sanguin. Dieu syrien debout sur un lion
MTAL_00220_propre_p84_104_AV	Appellation Structuree	1	Jaspe sanguin. Fête de Lanuvium
MTAL_00220_propre_p84_104_AV	Appellation Structuree	1	Jaspe sanguin. Hercule au jardin des Hespérides
MTAL_00220_propre_p84_104_AV	Appellation Structuree	1	Jaspe sanguin. Hermaphrodite
MTAL_00220_propre_p84_104_AV	Appellation Structuree	1	Jaspe sanguin. La Judée captive
MTAL_00220_propre_p84_104_AV	Appellation Structuree	1	Jaspe sanguin. Les Grecs redemandent Philoctète
MTAL_00220_propre_p84_104_AV	Appellation Structuree	1	Jaspe sanguin. Minerve
MTAL_00220_propre_p84_104_AV	Appellation Structuree	1	Jaspe sanguin. « La Nuit distribuant ses pavots
MTAL_00220_propre_p84_104_AV	Appellation Structuree	1	Jaspe. Bacchus entre deux Satyres
MTAL_00220_propre_p84_104_AV	Appellation Structuree	1	Jaspe. Isis
MTAL_00220_propre_p84_104_AV	Appellation Structuree	1	Jaspe. Laboureur offrant à Saturne les prémices de la moisson
MTAL_00220_propre_p84_104_AV	Appellation Structuree	1	Jaspe. Triple Hécate
MTAL_00220_propre_p84_104_AV	Appellation Structuree	1	Lapis. Apollon
MTAL_00220_propre_p84_104_AV	Appellation Structuree	1	Lapis. Scène champêtre
MTAL_00220_propre_p84_104_AV	Appellation Structuree	1	PIERRES GRAVÉESDES COLLECTIONS MARLBOROUGH ET D'ORLÉANS
MTAL_00220_propre_p84_104_AV	Appellation Structuree	1	Pierres gravées des collections Marlborough et d'Orléans
MTAL_00220_propre_p84_104_AV	Appellation Structuree	1	Prime d'émeraude. Dioscure
MTAL_00220_propre_p84_104_AV	Appellation Structuree	1	Prime d'émeraude. Hercule portant le Ciel
MTAL_00220_propre_p84_104_AV	Appellation Structuree	1	Prime d'émeraude. Mercure touchant de son caducée une borne
MTAL_00220_propre_p84_104_AV	Appellation Structuree	1	Prime d'émeraude. Triomphe de Silène
MTAL_00220_propre_p84_104_AV	Appellation Structuree	1	Sardonyx à biseau. Jupiter tenant le foudre et un sceptre
MTAL_00220_propre_p84_104_AV	Appellation Structuree	1	Sardonyx à deux couches. Satyre dansant
MTAL_00220_propre_p84_104_AV	Appellation Structuree	1	Sardonyx. La Paix et l'Abondance
MTAL_00220_propre_p84_104_AV	Appellation Structuree	2	Thétis habillant Achille en femme. Sardonyx
MTAL_00220_propre_p84_104_AV	Appellation Structuree	1	Tète de la Victoire. Sardonyx
MTAL_00220_propre_p84_104_AV	Appellation Structuree	1	Victoire debout sur un char traîné par deux chevaux. Sardonyx
MTAL_00220_propre_p84_104_AV	Appellation Structuree	1	Victoire debout sur un char traîné par quatre chevaux. Sardonyx
MTAL_00220_propre_p84_104_AV	Appellation Structuree	1	Vénus marine couchée sur un cheval marin. Sardonyx
MTAL_00220_propre_p84_104_AV	Appellation Structuree	1	buste de Jupiter Sérapis
MTAL_00220_propre_p84_104_AV	Appellation Structuree	2	camée Gonzague
MTAL_00220_propre_p84_104_AV	Appellation Structuree	1	figure de Diomède
MTAL_00220_propre_p84_104_AV	Appellation Structuree	1	figure de Jupiter
MTAL_00220_propre_p84_104_AV	Appellation Structuree	1	grand camée de la Sainte Chapelle
MTAL_00220_propre_p84_104_AV	Appellation Structuree	1	groupe des deux vendangeuses
MTAL_00220_propre_p84_104_AV	Appellation Structuree	1	groupe du Laocoon
MTAL_00220_propre_p84_104_AV	Appellation Structuree	1	marbres d'Elgin
MTAL_00220_propre_p84_104_AV	Appellation Structuree	1	médaillon de Périnthe à l'effigie d'Alexandre Sévère
MTAL_00220_propre_p84_104_AV	Appellation Structuree	1	ouvrage de Pyrgoteles
MTAL_00220_propre_p84_104_AV	Appellation Structuree	1	pierres gravées du cabinet royal
MTAL_00220_propre_p84_104_AV	Appellation Structuree	1	statue Farnèse
MTAL_00220_propre_p84_104_AV	Appellation Structuree	1	tête de Vespasien
MTAL_00220_propre_p84_104_AV	Appellation Structuree	1	xAméthyste. OEdipe et le sphinx
MTAL_00220_propre_p84_104_AV	Appellation Structuree	1	xHyacinlhe. Guerrier faisant une libation
MTAL_00220_propre_p84_104_AV	Appellation Enrichie	1	Agathe onyx. Bonus Evenius ou Génie de l'Abondance tenant des épis et une patère avec des fruits
MTAL_00220_propre_p84_104_AV	Appellation Enrichie	1	Chasseur (ou Apollon?)au repos
MTAL_00220_propre_p84_104_AV	Appellation Enrichie	1	Deucalion et Pyrrha [Isis et Osiris?]
MTAL_00220_propre_p84_104_AV	Appellation Enrichie	1	Grenat. Mên ou Lunus
MTAL_00220_propre_p84_104_AV	Appellation Enrichie	1	Guerrier (Diomède)
MTAL_00220_propre_p84_104_AV	Appellation Enrichie	1	Isis et Anubis
MTAL_00220_propre_p84_104_AV	Appellation Enrichie	1	la célèbre statue Farnèse
MTAL_00220_propre_p84_104_AV	Appellation Enrichie	1	tête dite de Mécène
MTAL_00220_propre_p84_104_AV	Appellation Complexe	1	Agate d'Allemagne (sardoine claire, suivant M.Chabouillet). Atalante et l'Amour, suivant Mariette
MTAL_00220_propre_p84_104_AV	Appellation Complexe	1	Agate grise. Triomphe d'un athlète ou scène bachique
MTAL_00220_propre_p84_104_AV	Appellation Complexe	1	Agate onyx de trois couleurs. Chasseur (ou Apollon?)au repos
MTAL_00220_propre_p84_104_AV	Appellation Complexe	1	Agate onyx à biseau. Cybèle tourelée sur un lion en course, tenant un sceptre et la foudre
MTAL_00220_propre_p84_104_AV	Appellation Complexe	1	Agate onyx. Déesse Rome. Une pierre
MTAL_00220_propre_p84_104_AV	Appellation Complexe	1	Amour accroupi, la jambe prise dans un trébuchet sur lequel il y a un papillon. Sardonyx
MTAL_00220_propre_p84_104_AV	Appellation Complexe	1	Apollon vêtu d'un manteau, appuyé sur un tronc d'arbre, tenant à la main une branche de laurier. Sardonyx
MTAL_00220_propre_p84_104_AV	Appellation Complexe	1	Cacus suivant Mariette
MTAL_00220_propre_p84_104_AV	Appellation Complexe	1	Cornaline en forme de scarabée. Hercule
MTAL_00220_propre_p84_104_AV	Appellation Complexe	1	Cornaline. Laocoon (d'après le groupe antique
MTAL_00220_propre_p84_104_AV	Appellation Complexe	1	Cornaline. Pied sur lequel repose un buste de Jupiter Sérapis
MTAL_00220_propre_p84_104_AV	Appellation Complexe	1	Deucalion et Pyrrha [Isis et Osiris?] dans une barque dont l'Amour dirige la voile. Sardonyx
MTAL_00220_propre_p84_104_AV	Appellation Complexe	1	Jaspe rouge ou hématite. Vénus et Vulcain forgeant les armes d'Énée
MTAL_00220_propre_p84_104_AV	Appellation Complexe	1	Jaspe sanguin (héliotrope, suivant Koehler). Triomphe de Silène
MTAL_00220_propre_p84_104_AV	Appellation Complexe	1	Jaspe sanguin. La Judée captive (d'après une monnaie)
MTAL_00220_propre_p84_104_AV	Appellation Complexe	1	L'Hercule est imité de la célèbre statue Farnèse
MTAL_00220_propre_p84_104_AV	Appellation Complexe	1	Laocoon gravé d'après le groupe de Rome
MTAL_00220_propre_p84_104_AV	Appellation Complexe	1	Minerve casquée et armée du bouclier, sur un char traîné par deux chevaux. Sardonyx
MTAL_00220_propre_p84_104_AV	Appellation Complexe	1	Nymphe de fontaine assise sur un rocher, tenant de la droite des roseaux, de la gauche une urne qu'elle renverse. Sardonyx
MTAL_00220_propre_p84_104_AV	Appellation Complexe	1	On y a vu tantôt Ménélas emportant Patrocle, tantôt Ajax emportant Achille
MTAL_00220_propre_p84_104_AV	Appellation Complexe	1	Prime d'émeraude. Dioscure (d'après un des groupes du Monte Cavallo à Rome
MTAL_00220_propre_p84_104_AV	Appellation Complexe	1	Prime d'émeraude. Mars, Vénus et l'Amour couronnant Vénus
MTAL_00220_propre_p84_104_AV	Appellation Complexe	1	Silène, une Bacchante et un Génie, couchés sur une panthère. Sardonyx à
MTAL_00220_propre_p84_104_AV	Appellation Complexe	1	Variante moderne d'une figure de Diomède
MTAL_00220_propre_p84_104_AV	Appellation Complexe	1	a vu dans cette figure « Calpurnie inquiète sur le sort de César »
MTAL_00220_propre_p84_104_AV	Appellation Complexe	1	ce serait Silène assis sur une outre
MTAL_00220_propre_p84_104_AV	Appellation Complexe	1	figure la tête de Vespasien
MTAL_00220_propre_p84_104_AV	Appellation Complexe	1	le sujet serait Hercule et Cycnus
MTAL_00220_propre_p84_104_AV	Appellation Complexe	1	monnaies grecques de Pescennius, au revers des quelles figure un Esculape
MTAL_00220_propre_p84_104_AV	Appellation Complexe	1	pierres se trouvait la tête dite de Mécène, ouvrage du célèbre Dioscoride
MTAL_00220_propre_p84_104_AV	Appellation Complexe	1	reconnaît dans cette scène « l'initiation d'un Luperque
MTAL_00220_propre_p84_104_AV	Appellation Complexe	1	représentant des Salyres et des Bacchantes qui célèbrent la fête des vendanges
MTAL_00220_propre_p84_104_AV	Appellation Complexe	1	représentation allégorique de la Tragédie, la Satyre et la Comédie
MTAL_00220_propre_p84_104_AV	Appellation Complexe	1	représente (( les grandes fêtes Panathénées d'Athènes
MTAL_00220_propre_p84_104_AV	Appellation Complexe	1	représente l'éducation et la naissance d'Alexandre le Grand, allégorisée comme l'éducation et la naissance de Bacchus
MTAL_00220_propre_p84_104_AV	Appellation Complexe	1	voyait là le combat d'Hercule et d'Achéloiïs
MTAL_00220_propre_p84_104_AV	Appellation Complexe	1	y reconnaissait une Vestale
MTAL_00220_propre_p84_104_AV	Appellation Complexe	1	y voit un simple sacrifice
MTAL_00220_propre_p84_104_AV	Appellation Complexe	1	y voyait « la déesse Salus
MTAL_00220_propre_p84_104_AV	Theme	1	 jeune Psylle
MTAL_00220_propre_p84_104_AV	Theme	1	. Génie du Sénat.
MTAL_00220_propre_p84_104_AV	Theme	1	. Sacrifice.
MTAL_00220_propre_p84_104_AV	Theme	1	. Victoire conduisant quadrige.
MTAL_00220_propre_p84_104_AV	Theme	1	Aigle tenant une couronne
MTAL_00220_propre_p84_104_AV	Theme	1	Ajax emportant Achille
MTAL_00220_propre_p84_104_AV	Theme	1	Amour accroupi
MTAL_00220_propre_p84_104_AV	Theme	1	Amour assis jouant avec un cygne
MTAL_00220_propre_p84_104_AV	Theme	1	Amour assis jouant de la lyre
MTAL_00220_propre_p84_104_AV	Theme	1	Amour couronnant Vénus
MTAL_00220_propre_p84_104_AV	Theme	1	Amour debout sur un autel
MTAL_00220_propre_p84_104_AV	Theme	1	Amour redemande son arc à Vénus
MTAL_00220_propre_p84_104_AV	Theme	1	Amour sur cheval marin
MTAL_00220_propre_p84_104_AV	Theme	1	Amour tenant une lyre
MTAL_00220_propre_p84_104_AV	Theme	1	Apollon couché auprès d'une petite statue
MTAL_00220_propre_p84_104_AV	Theme	1	Apollon et Amour
MTAL_00220_propre_p84_104_AV	Theme	1	Apollon et une Muse
MTAL_00220_propre_p84_104_AV	Theme	1	Apollon et Marsyas
MTAL_00220_propre_p84_104_AV	Theme	1	Atalante et l'Amour
MTAL_00220_propre_p84_104_AV	Theme	1	Athlète demandant le prix de sa victoire
MTAL_00220_propre_p84_104_AV	Theme	1	Bacchanale.
MTAL_00220_propre_p84_104_AV	Theme	1	Bacchante devant un autel
MTAL_00220_propre_p84_104_AV	Theme	1	Bacchante en délire devant un terme de Priape
MTAL_00220_propre_p84_104_AV	Theme	1	Bacchante faisant une libation sur un autel rustique
MTAL_00220_propre_p84_104_AV	Theme	1	Bacchante tenant un thyrse
MTAL_00220_propre_p84_104_AV	Theme	1	Bacchus entre deux Satyres
MTAL_00220_propre_p84_104_AV	Theme	1	Bacchus et Ariane sur un char
MTAL_00220_propre_p84_104_AV	Theme	1	Bacchus sacrifiant
MTAL_00220_propre_p84_104_AV	Theme	1	Calpurnie inquiète sur le sort de César
MTAL_00220_propre_p84_104_AV	Theme	1	Cavalier attaquant un lion
MTAL_00220_propre_p84_104_AV	Theme	1	Cerbère enchaîné par Hercule
MTAL_00220_propre_p84_104_AV	Theme	1	Cerf assailli par un lion
MTAL_00220_propre_p84_104_AV	Theme	1	Combat de cavaliers
MTAL_00220_propre_p84_104_AV	Theme	1	Cybèle tourelée sur un lion en course
MTAL_00220_propre_p84_104_AV	Theme	1	Cérès cherchant Proserpine
MTAL_00220_propre_p84_104_AV	Theme	1	Deucalion et Pyrrha
MTAL_00220_propre_p84_104_AV	Theme	1	Deucalion et Pyrrha [Isis et Osiris?] dans une barque
MTAL_00220_propre_p84_104_AV	Theme	1	Dieu syrien debout sur un lion
MTAL_00220_propre_p84_104_AV	Theme	1	Diomède maître du Palladium
MTAL_00220_propre_p84_104_AV	Theme	1	Esculape et Diane d'Êphèse
MTAL_00220_propre_p84_104_AV	Theme	1	Faune assis sur un rocher
MTAL_00220_propre_p84_104_AV	Theme	1	Fête de Lanuvium
MTAL_00220_propre_p84_104_AV	Theme	1	Fête à la suite des vendanges »
MTAL_00220_propre_p84_104_AV	Theme	1	Ganymède et l'aigle
MTAL_00220_propre_p84_104_AV	Theme	1	Grecs redemandent Philoctète
MTAL_00220_propre_p84_104_AV	Theme	1	Guerrier au repos
MTAL_00220_propre_p84_104_AV	Theme	1	Guerrier devant autel
MTAL_00220_propre_p84_104_AV	Theme	1	Guerrier faisant une libation
MTAL_00220_propre_p84_104_AV	Theme	1	Guerrier sacrifiant
MTAL_00220_propre_p84_104_AV	Theme	1	Génie Bacchique conduisant une lionne et une chèvre
MTAL_00220_propre_p84_104_AV	Theme	1	Génie assis tenant une grappe de raisin
MTAL_00220_propre_p84_104_AV	Theme	1	Génie bachique conduisant un char
MTAL_00220_propre_p84_104_AV	Theme	1	Génie de l'Abondance tenant des épis et une patère
MTAL_00220_propre_p84_104_AV	Theme	1	Hercule Musagète
MTAL_00220_propre_p84_104_AV	Theme	1	Hercule assommant Diomède
MTAL_00220_propre_p84_104_AV	Theme	1	Hercule au jardin des Hespérides
MTAL_00220_propre_p84_104_AV	Theme	3	Hercule aurepos
MTAL_00220_propre_p84_104_AV	Theme	1	Hercule brûlant l'hydre
MTAL_00220_propre_p84_104_AV	Theme	1	Hercule dompté par l'Amour
MTAL_00220_propre_p84_104_AV	Theme	1	Hercule enfant étouffant les serpents
MTAL_00220_propre_p84_104_AV	Theme	1	Hercule et Cycnus
MTAL_00220_propre_p84_104_AV	Theme	1	Hercule et OEdipe
MTAL_00220_propre_p84_104_AV	Theme	1	Hercule portant le Ciel
MTAL_00220_propre_p84_104_AV	Theme	1	Hercule tenant la massue et couronnant Minerve armée
MTAL_00220_propre_p84_104_AV	Theme	1	Hercule écrasant les serpents
MTAL_00220_propre_p84_104_AV	Theme	1	Hygie debout
MTAL_00220_propre_p84_104_AV	Theme	1	Isis et Anubis
MTAL_00220_propre_p84_104_AV	Theme	1	Isis et Osiris
MTAL_00220_propre_p84_104_AV	Theme	1	Jeune Faune ivre tenant d'une main un canlhare
MTAL_00220_propre_p84_104_AV	Theme	1	Judée captive
MTAL_00220_propre_p84_104_AV	Theme	1	Jupiter sur son trône
MTAL_00220_propre_p84_104_AV	Theme	1	Jupiter tenant le foudre et un sceptre
MTAL_00220_propre_p84_104_AV	Theme	1	Laboureur offrant à Saturne les prémices de la moisson
MTAL_00220_propre_p84_104_AV	Theme	2	Mars et Vénus
MTAL_00220_propre_p84_104_AV	Theme	2	Mars et la Victoire
MTAL_00220_propre_p84_104_AV	Theme	1	Mercure avec tous ses attributs
MTAL_00220_propre_p84_104_AV	Theme	1	Mercure touchant de son caducée une borne
MTAL_00220_propre_p84_104_AV	Theme	1	Minerve casquée et armée du bouclier
MTAL_00220_propre_p84_104_AV	Theme	1	Muse et Amour
MTAL_00220_propre_p84_104_AV	Theme	1	Ménélas emportant Patrocle
MTAL_00220_propre_p84_104_AV	Theme	1	Nuit distribuant ses pavots
MTAL_00220_propre_p84_104_AV	Theme	1	Nymphe de fontaine assise sur un rocher
MTAL_00220_propre_p84_104_AV	Theme	1	OEdipe et le sphinx
MTAL_00220_propre_p84_104_AV	Theme	1	Ouvrier forgeant un casque
MTAL_00220_propre_p84_104_AV	Theme	1	Paix et l'Abondance
MTAL_00220_propre_p84_104_AV	Theme	1	Piété militaire
MTAL_00220_propre_p84_104_AV	Theme	2	Retour d'Ulysse à Ithaque
MTAL_00220_propre_p84_104_AV	Theme	1	Sacrifice d'un serpent
MTAL_00220_propre_p84_104_AV	Theme	1	Sacrifice à Bacchus
MTAL_00220_propre_p84_104_AV	Theme	2	Sacrifice à Priape
MTAL_00220_propre_p84_104_AV	Theme	1	Salyres et des Bacchantes qui célèbrent la fête des vendanges
MTAL_00220_propre_p84_104_AV	Theme	1	Satyre dansant
MTAL_00220_propre_p84_104_AV	Theme	1	Satyre et Bacchus juvénile
MTAL_00220_propre_p84_104_AV	Theme	1	Sculpteur travaillant à un vase
MTAL_00220_propre_p84_104_AV	Theme	1	Scène champêtre
MTAL_00220_propre_p84_104_AV	Theme	1	Scène de sacrifice
MTAL_00220_propre_p84_104_AV	Theme	1	Silène assis sur une outre
MTAL_00220_propre_p84_104_AV	Theme	1	Silène, une Bacchante et un Génie
MTAL_00220_propre_p84_104_AV	Theme	1	Temps appuyé sur sa faux
