source	balise	occurrence	texte
MTAL_00289_propre_p260_fin_AV	Appellation Complexe	1	Nymphes du cortège de Dionysos. Peinture d'un aryballe attique.(Musée
MTAL_00289_propre_p260_fin_AV	Appellation Complexe	1	Néarchos, associé au sculpteur Anténor, l'auteur du groupe des Tyrannicides
MTAL_00289_propre_p260_fin_AV	Appellation Complexe	1	OEdipe et le Sphinx. (Cylix du musée Grégorien, au Vatican.)
MTAL_00289_propre_p260_fin_AV	Appellation Complexe	1	OEnochoé à peintures blanches. Provenant de Gnathia. (Musée du Louvre.)
MTAL_00289_propre_p260_fin_AV	Appellation Complexe	1	OEnochoé étrusque en terre noire. (Musée du Louvre.)
MTAL_00289_propre_p260_fin_AV	Appellation Complexe	1	Olla trouvée à Cervetri. (Musée du Louvre.)
MTAL_00289_propre_p260_fin_AV	Appellation Complexe	1	On n'a aucune peine à reconnaître les habitants légendaires des régions hyperboréennes, les Arimaspes
MTAL_00289_propre_p260_fin_AV	Appellation Complexe	1	Oreste à Delphes. Oxybaphon trouvé à Ruvo. (Musée du Louvre
MTAL_00289_propre_p260_fin_AV	Appellation Complexe	1	Oreste à Delphes. Oxybaphon trouvéà Ruvo (Musée du Louvre
MTAL_00289_propre_p260_fin_AV	Appellation Complexe	1	Ouvriers travaillant dans une carrière. Plaque corinthienne
MTAL_00289_propre_p260_fin_AV	Appellation Complexe	1	Pelée (mariage de) et de Thétis sur le vase François
MTAL_00289_propre_p260_fin_AV	Appellation Complexe	1	Persée et Andromède, peinture d'une olpé trouvée à Civré. (Musée deBerlin.)
MTAL_00289_propre_p260_fin_AV	Appellation Complexe	1	Phiale à ombilic et à peintures. (Musée du Louvre.)
MTAL_00289_propre_p260_fin_AV	Appellation Complexe	1	Phrixos et Hellé. Peinture d'un cratère d'Asstéas (Musée de Naples
MTAL_00289_propre_p260_fin_AV	Appellation Complexe	1	Polyphème aveuglé par les compagnons d'Ulysse. Vase trouvé à Cceré
MTAL_00289_propre_p260_fin_AV	Appellation Complexe	1	Poséidon. Plaque corinthienne. (Musée du Louvre.)
MTAL_00289_propre_p260_fin_AV	Appellation Complexe	1	Potier fabriquant un vase. Plaque corinthienne
MTAL_00289_propre_p260_fin_AV	Appellation Complexe	1	Praxitèle, en pleine période d'activité, exécute Y Eros de Thespies et le Satyre de la rue des Trépieds
MTAL_00289_propre_p260_fin_AV	Appellation Complexe	1	Praxitèle, représentant nue l'Aphrodite de Cnide
MTAL_00289_propre_p260_fin_AV	Appellation Complexe	1	Retour de Thésée, détail du vase François
MTAL_00289_propre_p260_fin_AV	Appellation Complexe	1	Rhyton en forme de tête d'animal. (Musée du Louvre.)
MTAL_00289_propre_p260_fin_AV	Appellation Complexe	1	Réunion de divinités. Fragment d'une coupe de Sosias. (Musée deBerlin.)
MTAL_00289_propre_p260_fin_AV	Appellation Complexe	1	Saciifice à Athéna. Peinture d'une amphore trouvée à Vulci, (Musée de Berlin
MTAL_00289_propre_p260_fin_AV	Appellation Complexe	1	Scène d'intérieur au gynécée. (Collection particulière d'Athènes
MTAL_00289_propre_p260_fin_AV	Appellation Complexe	1	Scène de phlyaque sur un cratère de la Grande-Grèce.(Musée de l'Ermitage, à Saint-Pétersbourg
MTAL_00289_propre_p260_fin_AV	Appellation Complexe	1	Scène de phlyaque. Peinture d'un cratère de la Grande-Grèce. (Musée duLouvre
MTAL_00289_propre_p260_fin_AV	Appellation Complexe	1	Scène de toilette. Lékané trouvée à Kertch. (Musée de l'Ermitage
MTAL_00289_propre_p260_fin_AV	Appellation Complexe	1	Scène de toilette. Peinture d'une pyxis attique. (British Muséum
MTAL_00289_propre_p260_fin_AV	Appellation Complexe	1	Scène du culte des morts. Lécythe athénien. (Musée du Louvre.)
MTAL_00289_propre_p260_fin_AV	Appellation Complexe	1	Scènes de toilette. Lékané trouvée à Kertch. (Musée de l'Ermitage, à Saint-Pétersbourg
MTAL_00289_propre_p260_fin_AV	Appellation Complexe	1	Thésée combattant contre les Amazones. Aryballe trouvé à Cumes. (Muséede Naples
MTAL_00289_propre_p260_fin_AV	Appellation Complexe	1	Thésée recevant d'Amphitrite l'anneau de Minos. Peinture d'une couped'Euphronios. (Musée du Louvre.)
MTAL_00289_propre_p260_fin_AV	Appellation Complexe	1	Thétis et Pelée. Péliké de Camiros. (British Muséum
MTAL_00289_propre_p260_fin_AV	Appellation Complexe	1	Vase en forme de sphinx
MTAL_00289_propre_p260_fin_AV	Appellation Complexe	1	Vase en forme de sphinx. (Musée de l'Ermitage, à Saint-Pétersbourg
MTAL_00289_propre_p260_fin_AV	Appellation Complexe	1	Vase émaillé en forme de sphinx, provenant d'Egine. - Musée de Berlin
MTAL_00289_propre_p260_fin_AV	Appellation Complexe	1	a la forme d'un canard, sur le dos duquel s'ajuste un goulot muni d'une anse ronde. L'oiseau sert de monture à un Éros ailé
MTAL_00289_propre_p260_fin_AV	Appellation Complexe	1	amphore, qui a fait partie successivement des collections Barone et Alessandro Castellani, et appartient aujourd'hui au British Muséum L SOUS les anses sont des têtes d'Héraclès
MTAL_00289_propre_p260_fin_AV	Appellation Complexe	1	aryballe du musée de la Société archéologique d'Athènes, représentant Hermès et Maîa
MTAL_00289_propre_p260_fin_AV	Appellation Complexe	1	aryballes en forme de tête d'Héraclès, trouvés dans l'île de Cos, à Camiros, et en Attique
MTAL_00289_propre_p260_fin_AV	Appellation Complexe	1	aryballesen forme de tête casquée, trouvés à Camiros et en Italie
MTAL_00289_propre_p260_fin_AV	Appellation Complexe	1	aventures d'Ulysse. Phiale à ombilic et à vernis noir.(Fabrique campanienne
MTAL_00289_propre_p260_fin_AV	Appellation Complexe	1	certains types, comme des statuettes d'Apollon
MTAL_00289_propre_p260_fin_AV	Appellation Complexe	1	ces vases offrent une scène identique pour l'idée d'ensemble et les grandes lignes de la composition
MTAL_00289_propre_p260_fin_AV	Appellation Complexe	1	char de Dionysos. Péliké provenant de la Cyrénaïque. (Musée du Louvre
MTAL_00289_propre_p260_fin_AV	Appellation Complexe	1	char de Dionysos. Péliké provenant de la Cyrénaïque. (Musée duLouvre
MTAL_00289_propre_p260_fin_AV	Appellation Complexe	1	chasse de Calydon, détail du vase François
MTAL_00289_propre_p260_fin_AV	Appellation Complexe	1	combat des dieux et des Géants. - Amphore trouvée à Milo.Musée du Louvre
MTAL_00289_propre_p260_fin_AV	Appellation Complexe	1	combat des dieux et des Géants. Amphore trouvée à Milo. (Musée duLouvre
MTAL_00289_propre_p260_fin_AV	Appellation Complexe	1	combats entre Grecs et Amazones, entre les Arimaspes et les griffons
MTAL_00289_propre_p260_fin_AV	Appellation Complexe	1	cratère du Cabinet des Médailles qui a fait partie de la collection Beugnot
MTAL_00289_propre_p260_fin_AV	Appellation Complexe	1	cratère du Louvre, représente, suivant toute vraisemblance, une scène de la légende d'Urysse
MTAL_00289_propre_p260_fin_AV	Appellation Complexe	1	cratère du musée de Naples, montrant Phrixos et Hellé traversant l'Hellespont
MTAL_00289_propre_p260_fin_AV	Appellation Complexe	1	d'autres représentent les divinités phrygiennes et alexandrines, Attis et Sérapis
MTAL_00289_propre_p260_fin_AV	Appellation Complexe	1	dans les intervalles sont figurés Athéna combattant contre un Géant, et deux héros luttant contre un Centaure
MTAL_00289_propre_p260_fin_AV	Appellation Complexe	1	dieux aux noces de Pelée et de Thétis, détail du vase François
MTAL_00289_propre_p260_fin_AV	Appellation Complexe	1	dont le sujet est emprunté aux mythes éleusiniens
MTAL_00289_propre_p260_fin_AV	Appellation Complexe	1	décor marin sur un plat provenant de Capoue au musée de Berlin
MTAL_00289_propre_p260_fin_AV	Appellation Complexe	1	emprunté au thème favori du décorateur, à savoir les jeux des Amours
MTAL_00289_propre_p260_fin_AV	Appellation Complexe	1	est représenté Zeus debout
MTAL_00289_propre_p260_fin_AV	Appellation Complexe	1	exemplaire conservé à Saint-Pétersbourg, dans la collection de l'Académie des sciences, montre une procession bachique
MTAL_00289_propre_p260_fin_AV	Appellation Complexe	1	font une large place aux scènes bien connues des archéologues sous le nom de scènes bachiques ou nrystiques
MTAL_00289_propre_p260_fin_AV	Appellation Complexe	1	frise en relief représentant
MTAL_00289_propre_p260_fin_AV	Appellation Complexe	1	frise représentant le combat des Grecs et des Amazones
MTAL_00289_propre_p260_fin_AV	Appellation Complexe	1	grand cratère de l'Ermitage représentant le Jugement de Paris
MTAL_00289_propre_p260_fin_AV	Appellation Complexe	1	il a la forme d'un sphinx
MTAL_00289_propre_p260_fin_AV	Appellation Complexe	1	il les rapproche d'une hydrie de Capoue, représentant un buste colossal de femme entre deux Satyres bêchant la terre. (Musées de France
MTAL_00289_propre_p260_fin_AV	Appellation Complexe	1	ils montrent Hermès avec le caducée
MTAL_00289_propre_p260_fin_AV	Appellation Complexe	1	kélébé corinthienne, que M. Furtwaengler attribue au cinquième siècle^, porte une décoration en relief représentant les exploits d'Héraclès
MTAL_00289_propre_p260_fin_AV	Appellation Complexe	1	kélébé de Kythnos ' montrent des Amazones combattant contre des Grecs ou contre un griffon
MTAL_00289_propre_p260_fin_AV	Appellation Complexe	1	l'aryballe dont la décoration en relief représente Andromaque assise sur le tombeau d'Hector
MTAL_00289_propre_p260_fin_AV	Appellation Complexe	1	l'attitude de l'Aphrodite de Vienne conservée au Louvre
MTAL_00289_propre_p260_fin_AV	Appellation Complexe	1	le sujet est presque toujours un Amour
MTAL_00289_propre_p260_fin_AV	Appellation Complexe	1	le type si particulier de la tête coiffée à l'orientale entre un cheval et un griffon
MTAL_00289_propre_p260_fin_AV	Appellation Complexe	1	les sujets qui reviennent le plus fréquemment sont des scènes d'amour
MTAL_00289_propre_p260_fin_AV	Appellation Complexe	1	les sujets sont empruntés à la légende d'Héraclès et montrent le héros combattant contre le lion de Némée
MTAL_00289_propre_p260_fin_AV	Appellation Complexe	1	magnifique oenochoé à panse cannelée, portant en relief une Bacchante devant un hermès de Dionysos
MTAL_00289_propre_p260_fin_AV	Appellation Complexe	1	montrant la tête du fleuve Alphée adossée à celle de la n)'mphe Aréthuse
MTAL_00289_propre_p260_fin_AV	Appellation Complexe	1	morte auprès de la stèle. Lécythe athénien. (Musée du Louvre.).
MTAL_00289_propre_p260_fin_AV	Appellation Complexe	1	musée de l'Ermitage que nous en trouverons le plus beau spécimen, dans la célèbre hydrie de l'ancienne collection Campana, trouvée à Cumes
MTAL_00289_propre_p260_fin_AV	Appellation Complexe	1	médaillon du British Muséum montre un jeune homme, sans doute Apollon, gracieusement appuyé sur l'épaule d'une Muse
MTAL_00289_propre_p260_fin_AV	Appellation Complexe	1	oenochoé du Louvre, dont les anses sont ornées de rotules portant en relief une tête de cheval
MTAL_00289_propre_p260_fin_AV	Appellation Complexe	1	oenochoé du Louvre, à panse cannelée, provenant de Gnathia ' (fig. . Le masque de théâtre et la guirlande qui décorent le col
MTAL_00289_propre_p260_fin_AV	Appellation Complexe	1	on le voit sur des lécythes du Louvre, de travail plus négligé, où des Eros et des Victoires
MTAL_00289_propre_p260_fin_AV	Appellation Complexe	1	on retrouve des sujets bien helléniques, par exemple Ulysse et les Sirènes ', Pan et Écho, un Centaure percé d'une flèche
MTAL_00289_propre_p260_fin_AV	Appellation Complexe	1	palais d'Hadès. Amphore de Canosa. (Pinacothèque de Munich
MTAL_00289_propre_p260_fin_AV	Appellation Complexe	1	patère trouvée à Corneto* qui représente l'Enlèvement de Coré par Pluton
MTAL_00289_propre_p260_fin_AV	Appellation Complexe	1	portrait : elle nous offre les traits de Bérénice, fille de Magas
MTAL_00289_propre_p260_fin_AV	Appellation Complexe	1	procession bachique analogue à celles qui décorent des sarcophages romains
MTAL_00289_propre_p260_fin_AV	Appellation Complexe	1	procession de dieux sur le vase François
MTAL_00289_propre_p260_fin_AV	Appellation Complexe	1	produits désignés fort improprement sous le nom de porcelaines ou de faïences égyptiennes
MTAL_00289_propre_p260_fin_AV	Appellation Complexe	1	remarquable chéneau de Métaponte, dont la libéralité du duc de Luynes a enrichi le Cabinet des médailles
MTAL_00289_propre_p260_fin_AV	Appellation Complexe	1	reproduisant les sujets chers à l'art alexandrin : combats d'Amai
MTAL_00289_propre_p260_fin_AV	Appellation Complexe	1	représentant en caricature l'apothéose d'Héraclès
MTAL_00289_propre_p260_fin_AV	Appellation Complexe	1	représentation très fréquente dans la céramique tarentine, à savoir une scène de comédie
MTAL_00289_propre_p260_fin_AV	Appellation Complexe	1	représentations où figure la courtisane
MTAL_00289_propre_p260_fin_AV	Appellation Complexe	1	représente quatre épisodes des aventures d'Ulysse à son retour d'Ilion
MTAL_00289_propre_p260_fin_AV	Appellation Complexe	1	représente, répété trois fois, un groupe composé de Niké conduisant son char et d'un héros tirant de l'arc
MTAL_00289_propre_p260_fin_AV	Appellation Complexe	1	roi Arcésilas assistant au pesage de la laine. Cvlix trouvée à Vulci
MTAL_00289_propre_p260_fin_AV	Appellation Complexe	1	répétition d'un même motif reproduit dans les quatre scènes; nous voulons parler du vaisseau d'Ulysse
MTAL_00289_propre_p260_fin_AV	Appellation Complexe	1	s'inspirent de sujets historiques et représentent, par exemple, des scènes de la vie de Trajan
MTAL_00289_propre_p260_fin_AV	Appellation Complexe	1	scène amusante est celle du cratère peint par Asstéas
MTAL_00289_propre_p260_fin_AV	Appellation Complexe	1	scène fréquemment reproduite : des personnages avec l'équipement de guerre
MTAL_00289_propre_p260_fin_AV	Appellation Complexe	1	scènes de galanterie, de bombance et de plaisir
MTAL_00289_propre_p260_fin_AV	Appellation Complexe	1	scènes de toilette ou de conversation galante
MTAL_00289_propre_p260_fin_AV	Appellation Complexe	1	scènes de toilette que le peintre a représentées sur le couvercle du vase
MTAL_00289_propre_p260_fin_AV	Appellation Complexe	1	sont représentés l'Aurore et Hélios, tous deux montés sur leurs chars
MTAL_00289_propre_p260_fin_AV	Appellation Complexe	1	statuette vernissée d'Hermès, signée du nom de P. Fabius Nicias, et trouvée à Angers
MTAL_00289_propre_p260_fin_AV	Appellation Complexe	1	suicide d'Ajax, détail d'un vase de Ca:ré. (Musée du Louvre.)
MTAL_00289_propre_p260_fin_AV	Appellation Complexe	1	sujets mythologiques peints par Asstéas :Héraclès au jardin des Hespérides
MTAL_00289_propre_p260_fin_AV	Appellation Complexe	1	sujets sont empruntés à la représentation de l'enfer
MTAL_00289_propre_p260_fin_AV	Appellation Complexe	1	sur la panse, un gorgonéion surmonté d'un Éros
MTAL_00289_propre_p260_fin_AV	Appellation Complexe	1	sur le vase François
MTAL_00289_propre_p260_fin_AV	Appellation Complexe	1	sur levase François
MTAL_00289_propre_p260_fin_AV	Appellation Complexe	1	type de Borée qui ne rappelle celui du Thanatos des lécythes athéniens
MTAL_00289_propre_p260_fin_AV	Appellation Complexe	1	tête modelée en relief, où l'on retrouve le type des Satyres rustiques
MTAL_00289_propre_p260_fin_AV	Appellation Complexe	1	têtes de griffons sur les vases de la Cyrénaïque
MTAL_00289_propre_p260_fin_AV	Appellation Complexe	1	vase de la collection Caputi, trouvé à Ruvo en i, montre une véritable scène de gloutonnerie
MTAL_00289_propre_p260_fin_AV	Appellation Complexe	1	vase de la reine Bérénice. OEnochoé provenant de Benghazi
MTAL_00289_propre_p260_fin_AV	Appellation Complexe	1	"vase de la reine Bérénice.Ginochoé provenant de Benghazi.( Paris. Appartient à M""""""« Beulé"
MTAL_00289_propre_p260_fin_AV	Appellation Complexe	1	vase du Louvre , on voit un esclave recevant les ordres de son maître
MTAL_00289_propre_p260_fin_AV	Appellation Complexe	1	vase du Louvre, un skyphos
MTAL_00289_propre_p260_fin_AV	Appellation Complexe	1	vase du musée de Naples qui s'en rapproche beaucoup pour le style ', les Géants
MTAL_00289_propre_p260_fin_AV	Appellation Complexe	1	vase à tête de bélier du musée de Berlin
MTAL_00289_propre_p260_fin_AV	Appellation Complexe	1	vase émaillé représentant Bérénice trouvé à Benghazi
MTAL_00289_propre_p260_fin_AV	Appellation Complexe	1	vases de la Cyrénaïque du British Muséum
MTAL_00289_propre_p260_fin_AV	Appellation Complexe	1	vases en forme de buste. Le Louvre en possède un bon spécimen, à savoir un buste d'Aphrodite
MTAL_00289_propre_p260_fin_AV	Appellation Complexe	1	y reconnaissait la Nuit
MTAL_00289_propre_p260_fin_AV	Appellation Complexe	1	Éros sur un canard. Vase en terre émaillée trouvé à Tanagra
MTAL_00289_propre_p260_fin_AV	Appellation Complexe	1	Éros tenant une couronne. (Lécythe du Musée de Berlin
MTAL_00289_propre_p260_fin_AV	Appellation Complexe	1	à Castle Howard, et représentant l'apothéose d'Alcmène
MTAL_00289_propre_p260_fin_AV	Appellation Complexe	1	élégant décor, si gracieux et si léger, est du plus pur goût pompéien; Amours, guirlandes de feuillages, masques bachiques
MTAL_00289_propre_p260_fin_AV	Appellation Complexe	1	épisodes du combat des. Grecs contre les Amazones
MTAL_00289_propre_p260_fin_AV	Appellation Complexe	1	épisodes du cycle troyen, comme l'enlèvement du Palladion
MTAL_00289_propre_p260_fin_AV	Theme	1	
MTAL_00289_propre_p260_fin_AV	Theme	1	Achille bandant le bras de Patrocle
MTAL_00289_propre_p260_fin_AV	Theme	1	Achille et Ajax jouant à la pettie
MTAL_00289_propre_p260_fin_AV	Theme	1	Achille tuant Troïlos
MTAL_00289_propre_p260_fin_AV	Theme	2	Ajax égorgeant un captif
MTAL_00289_propre_p260_fin_AV	Theme	2	Alphée et Aréthuse
MTAL_00289_propre_p260_fin_AV	Theme	1	Amazones combattant contre des Grecs
MTAL_00289_propre_p260_fin_AV	Theme	1	Amours désarmant Heicule
MTAL_00289_propre_p260_fin_AV	Theme	2	Amours désarmant Hercule
MTAL_00289_propre_p260_fin_AV	Theme	1	Amoursur un chien
MTAL_00289_propre_p260_fin_AV	Theme	1	Andromaque assise sur le tombeau d'Hector
MTAL_00289_propre_p260_fin_AV	Theme	2	Aphrodite et Adonis
MTAL_00289_propre_p260_fin_AV	Theme	1	Apollon et Arte'mis
MTAL_00289_propre_p260_fin_AV	Theme	1	Arimaspes combattant contre des griffons
MTAL_00289_propre_p260_fin_AV	Theme	1	Athéna combattant contre un Géant
MTAL_00289_propre_p260_fin_AV	Theme	1	Athéna dans l'attitude de la Promachos
MTAL_00289_propre_p260_fin_AV	Theme	1	Athéna et Poséidon
MTAL_00289_propre_p260_fin_AV	Theme	1	Athéniennes à la fontaine Callirhoé
MTAL_00289_propre_p260_fin_AV	Theme	1	Attis et Sérapis
MTAL_00289_propre_p260_fin_AV	Theme	1	Aurore et Hélios
MTAL_00289_propre_p260_fin_AV	Theme	1	Aurore sur un quadrige
MTAL_00289_propre_p260_fin_AV	Theme	1	Aventures d'U|ysse
MTAL_00289_propre_p260_fin_AV	Theme	1	Bacchante devant un hermès de Dionysos
MTAL_00289_propre_p260_fin_AV	Theme	2	Borée enlevant Orithyie
MTAL_00289_propre_p260_fin_AV	Theme	1	Cadmos engageant la lutte contre le dragon
MTAL_00289_propre_p260_fin_AV	Theme	1	Centaure percé d'une flèche
MTAL_00289_propre_p260_fin_AV	Theme	1	Chiron et Achille
MTAL_00289_propre_p260_fin_AV	Theme	1	Circé et Ulysse
MTAL_00289_propre_p260_fin_AV	Theme	1	Combat d'Héraclès contre Géryon
MTAL_00289_propre_p260_fin_AV	Theme	1	Combat d'Héraclès et d'Antée
MTAL_00289_propre_p260_fin_AV	Theme	1	Danse de Bacchantes
MTAL_00289_propre_p260_fin_AV	Theme	2	Dionysos dans une scène de banquet
MTAL_00289_propre_p260_fin_AV	Theme	1	Dionysos entouré de Silènes
MTAL_00289_propre_p260_fin_AV	Theme	1	Dionysos entouré de son cycle
MTAL_00289_propre_p260_fin_AV	Theme	1	Dionysos et Ariadne escortés de deux Bacchantes
MTAL_00289_propre_p260_fin_AV	Theme	1	Dionysos jouant avec une panthère
MTAL_00289_propre_p260_fin_AV	Theme	1	Départ de Triptoième
MTAL_00289_propre_p260_fin_AV	Theme	1	Départ du guerrier
MTAL_00289_propre_p260_fin_AV	Theme	1	Déposition au tombeau
MTAL_00289_propre_p260_fin_AV	Theme	1	Enlèvement de Coré par Pluton
MTAL_00289_propre_p260_fin_AV	Theme	1	Eros sur un canard
MTAL_00289_propre_p260_fin_AV	Theme	1	Exposition du mort
MTAL_00289_propre_p260_fin_AV	Theme	1	Exposition funèbre
MTAL_00289_propre_p260_fin_AV	Theme	1	Funérailles (cérémonies des)
MTAL_00289_propre_p260_fin_AV	Theme	1	Grecs contre les Amazones
MTAL_00289_propre_p260_fin_AV	Theme	1	Grecs et Amazones
MTAL_00289_propre_p260_fin_AV	Theme	1	Grecs et Amazones s'armant
MTAL_00289_propre_p260_fin_AV	Theme	1	Hector et Politès sortant de Troie
MTAL_00289_propre_p260_fin_AV	Theme	1	Hercule désarmé parles Amours et tenant un skyphos
MTAL_00289_propre_p260_fin_AV	Theme	1	Hermès apportant Dionysos enfant à Silène
MTAL_00289_propre_p260_fin_AV	Theme	1	Hermès avec le caducée
MTAL_00289_propre_p260_fin_AV	Theme	1	Hermès et Maîa
MTAL_00289_propre_p260_fin_AV	Theme	1	Hypnos et Thanatos emportant le cadavre de Sarpédon
MTAL_00289_propre_p260_fin_AV	Theme	1	Hypnos portant le corps de Sarpédon
MTAL_00289_propre_p260_fin_AV	Theme	1	Hébé et Héra
MTAL_00289_propre_p260_fin_AV	Theme	1	Hélène poursuivie par Mendias
MTAL_00289_propre_p260_fin_AV	Theme	1	Héra attaquée par les Silènes
MTAL_00289_propre_p260_fin_AV	Theme	1	Héra attaquée parles Silènes
MTAL_00289_propre_p260_fin_AV	Theme	1	Héra et Hébé
MTAL_00289_propre_p260_fin_AV	Theme	1	Héraclès au jardin des Hespérides
MTAL_00289_propre_p260_fin_AV	Theme	1	Héraclès chez Eurytos
MTAL_00289_propre_p260_fin_AV	Theme	1	Héraclès conduit dans l'Olympe par Athéna
MTAL_00289_propre_p260_fin_AV	Theme	1	Héraclès et les Centaures
MTAL_00289_propre_p260_fin_AV	Theme	2	Héraclès furieux
MTAL_00289_propre_p260_fin_AV	Theme	1	Héraclès jeune
MTAL_00289_propre_p260_fin_AV	Theme	2	Héraclès à Delphes
MTAL_00289_propre_p260_fin_AV	Theme	4	Jugement de Paris
MTAL_00289_propre_p260_fin_AV	Theme	1	L'offrande au tombeau
MTAL_00289_propre_p260_fin_AV	Theme	1	Le massacre des Priamides
MTAL_00289_propre_p260_fin_AV	Theme	1	Lutte d'Héraclès contre Triton
MTAL_00289_propre_p260_fin_AV	Theme	1	Memnon enlevé par Héos
MTAL_00289_propre_p260_fin_AV	Theme	1	Ménades dansant
MTAL_00289_propre_p260_fin_AV	Theme	1	Ménélas et Hélène
MTAL_00289_propre_p260_fin_AV	Theme	1	Naissance d'Athéna
MTAL_00289_propre_p260_fin_AV	Theme	1	Niké conduisant son char
MTAL_00289_propre_p260_fin_AV	Theme	1	Nymphes du cortège de Dionysos
MTAL_00289_propre_p260_fin_AV	Theme	1	Néoptolème s'apprétant à égorger Priam
MTAL_00289_propre_p260_fin_AV	Theme	1	OEdipe et le Sphinx
MTAL_00289_propre_p260_fin_AV	Theme	1	Offrandes au tombeau
MTAL_00289_propre_p260_fin_AV	Theme	2	Oreste à Delphes
MTAL_00289_propre_p260_fin_AV	Theme	1	Orithyie enlevée par Borée
MTAL_00289_propre_p260_fin_AV	Theme	1	Pan et Écho
MTAL_00289_propre_p260_fin_AV	Theme	1	Paris et les trois déesses
MTAL_00289_propre_p260_fin_AV	Theme	1	Persée et Andromède
MTAL_00289_propre_p260_fin_AV	Theme	1	Persée tuant la Gorgone
MTAL_00289_propre_p260_fin_AV	Theme	1	Philoctète mettant le feu au bûcher d'Hercule
MTAL_00289_propre_p260_fin_AV	Theme	3	Phrixos et Hellé
MTAL_00289_propre_p260_fin_AV	Theme	1	Phrixos et Hellé traversant l'Hellespont
MTAL_00289_propre_p260_fin_AV	Theme	1	Polyphème aveuglé
MTAL_00289_propre_p260_fin_AV	Theme	1	Polyphème et Ulysse
MTAL_00289_propre_p260_fin_AV	Theme	1	Potier fabriquant un vase
MTAL_00289_propre_p260_fin_AV	Theme	1	Prométhée enchaîné
MTAL_00289_propre_p260_fin_AV	Theme	1	Retour de Thésée
MTAL_00289_propre_p260_fin_AV	Theme	1	Réunion de divinités
MTAL_00289_propre_p260_fin_AV	Theme	1	Saciifice à Athéna
MTAL_00289_propre_p260_fin_AV	Theme	1	Satyres bêchant la terre
MTAL_00289_propre_p260_fin_AV	Theme	1	Scène d'intérieur au gynécée
MTAL_00289_propre_p260_fin_AV	Theme	4	Scène de phlyaque
MTAL_00289_propre_p260_fin_AV	Theme	2	Scène de toilette
MTAL_00289_propre_p260_fin_AV	Theme	1	Scène du culte des morts
MTAL_00289_propre_p260_fin_AV	Theme	1	Scènes de toilette
MTAL_00289_propre_p260_fin_AV	Theme	1	Thanatos portant le corps de Sarpédon
MTAL_00289_propre_p260_fin_AV	Theme	1	Thésée combattant contre les Amazones
MTAL_00289_propre_p260_fin_AV	Theme	1	Thésée etMinos
MTAL_00289_propre_p260_fin_AV	Theme	1	Thésée recevant d'Amphitrite l'anneau de Minos
MTAL_00289_propre_p260_fin_AV	Theme	1	Thétis et Pelée
MTAL_00289_propre_p260_fin_AV	Theme	1	Tritonides associées à des Amours
MTAL_00289_propre_p260_fin_AV	Theme	1	Ulysse chez Circé
MTAL_00289_propre_p260_fin_AV	Theme	1	Ulysse et Polyphème
MTAL_00289_propre_p260_fin_AV	Theme	2	Ulysse et les Sirènes
MTAL_00289_propre_p260_fin_AV	Theme	1	Zeus escorté d'Hermès
MTAL_00289_propre_p260_fin_AV	Theme	1	apothéose d'Alcmène
MTAL_00289_propre_p260_fin_AV	Theme	1	apothéose d'Hercule
MTAL_00289_propre_p260_fin_AV	Theme	2	apothéose d'Héraclès
MTAL_00289_propre_p260_fin_AV	Theme	1	attelage de Centaures
MTAL_00289_propre_p260_fin_AV	Theme	2	aventure galante
MTAL_00289_propre_p260_fin_AV	Theme	1	aventures d'Héraclès
MTAL_00289_propre_p260_fin_AV	Theme	3	aventures d'Ulysse
MTAL_00289_propre_p260_fin_AV	Theme	1	campagne des Amazones contre les griffons
MTAL_00289_propre_p260_fin_AV	Theme	2	char de Dionysos
MTAL_00289_propre_p260_fin_AV	Theme	2	chasse de Calydon
MTAL_00289_propre_p260_fin_AV	Theme	1	chasse orientale
MTAL_00289_propre_p260_fin_AV	Theme	1	combat d'Hector et de Mendias
MTAL_00289_propre_p260_fin_AV	Theme	1	combat d'Héraclès et de Géryon
MTAL_00289_propre_p260_fin_AV	Theme	1	combat d'Héraclès et de Triton
MTAL_00289_propre_p260_fin_AV	Theme	1	combat d'Héraclès et du lion de Némée
MTAL_00289_propre_p260_fin_AV	Theme	1	combat d'Héraclè» et d'Antée
MTAL_00289_propre_p260_fin_AV	Theme	1	combat des Grecs et des Amazones
MTAL_00289_propre_p260_fin_AV	Theme	1	combat des dieux contre les Géants
MTAL_00289_propre_p260_fin_AV	Theme	2	combat des dieux et des Géants
MTAL_00289_propre_p260_fin_AV	Theme	1	combats de Grecs et d'Amazones
MTAL_00289_propre_p260_fin_AV	Theme	1	combats entre Grecs et Amazones
MTAL_00289_propre_p260_fin_AV	Theme	1	conversation galante
MTAL_00289_propre_p260_fin_AV	Theme	1	course de chars
